{
  "schema_version": "interface-a-envelope.v1",
  "batch_id": "6f1c2d9e-3a41-4b7e-9c55-0d2e8a7b1f34",
  "device_id": "b7a2f0c4-91d3-4e68-8f1a-5c3d7e9b2a10",
  "created_at": "2026-10-09T11:05:12Z",
  "document_schema": "interface-a.v1",
  "alg": "AES-256-GCM",
  "key_id": "k-2026-10",
  "nonce": "q83vEjRZk2mP0aLx",
  "ciphertext": "SGVsbG8sIHRoaXMgaXMgbm90IHJlYWwgY2lwaGVydGV4dC4gSXQgb25seSBzaG93cyB0aGUgc2hhcGUgb2YgdGhlIGZpZWxkLg=="
}
